Crime ID,Month,Reported by,Falls within,Longitude,Latitude,Location,LSOA code,LSOA name,Crime type,Last outcome category
,2011-04,,Metropolitan Police Service,0.112771,51.613203,On or near Bearing Way,E01003723,Redbridge 002C,Burglary,
,2011-04,,Metropolitan Police Service,0.121321,51.61134,On or near Marlyon Road,E01003726,Redbridge 002D,Burglary,
,2011-04,,Metropolitan Police Service,0.097877,51.605035,On or near Clinton Crescent,E01003721,Redbridge 003A,Burglary,
,2011-04,,Metropolitan Police Service,0.099305,51.612806,On or near Stevens Way,E01003724,Redbridge 003B,Burglary,
,2011-04,,Metropolitan Police Service,0.098459,51.611068,On or near Bramshill Close,E01003724,Redbridge 003B,Burglary,
,2011-04,,Metropolitan Police Service,0.096987,51.609206,On or near Karina Close,E01003725,Redbridge 003C,Burglary,
,2011-04,,Metropolitan Police Service,0.106362,51.609865,On or near Fletcher Road,E01003727,Redbridge 003D,Burglary,
,2011-04,,Metropolitan Police Service,0.104334,51.611296,On or near Burrow Close,E01003727,Redbridge 003D,Burglary,
,2011-04,,Metropolitan Police Service,0.04026,51.605458,On or near Greenstead Avenue,E01003654,Redbridge 004A,Burglary,
,2011-04,,Metropolitan Police Service,0.040416,51.604421,On or near Roxwell Way,E01003654,Redbridge 004A,Burglary,
,2011-04,,Metropolitan Police Service,0.035323,51.603889,On or near Spring Gardens,E01003654,Redbridge 004A,Burglary,
,2011-04,,Metropolitan Police Service,0.036807,51.604133,On or near St Anthony'S Avenue,E01003654,Redbridge 004A,Burglary,
,2011-04,,Metropolitan Police Service,0.040631,51.611143,On or near Prospect Road,E01003655,Redbridge 004B,Burglary,
,2011-04,,Metropolitan Police Service,0.041768,51.605575,On or near Willingale Close,E01003658,Redbridge 004C,Burglary,
,2011-04,,Metropolitan Police Service,0.042054,51.60423,On or near Debden Close,E01003658,Redbridge 004C,Burglary,
,2011-04,,Metropolitan Police Service,0.045302,51.614803,On or near Bush Road,E01003660,Redbridge 004D,Burglary,
,2011-04,,Metropolitan Police Service,0.044906,51.615961,On or near Buckhurst Way,E01003660,Redbridge 004D,Burglary,
,2011-04,,Metropolitan Police Service,0.041144,51.614866,On or near Grangeway,E01003660,Redbridge 004D,Burglary,
,2011-04,,Metropolitan Police Service,0.056125,51.608184,On or near Purleigh Avenue,E01003656,Redbridge 005A,Burglary,
,2011-04,,Metropolitan Police Service,0.054011,51.604543,On or near Roding Lane North,E01003657,Redbridge 005B,Burglary,
,2011-04,,Metropolitan Police Service,0.051921,51.60431,On or near Gaynes Hill Road,E01003657,Redbridge 005B,Burglary,
,2011-04,,Metropolitan Police Service,0.053346,51.604528,On or near Roding Avenue,E01003657,Redbridge 005B,Burglary,
,2011-04,,Metropolitan Police Service,0.041944,51.602101,On or near Goldhaze Close,E01003659,Redbridge 005C,Burglary,
,2011-04,,Metropolitan Police Service,0.052824,51.602244,On or near Highfield Road,E01003659,Redbridge 005C,Burglary,
,2011-04,,Metropolitan Police Service,0.079689,51.604262,On or near Boleyn Way,E01003698,Redbridge 006A,Burglary,
,2011-04,,Metropolitan Police Service,0.082815,51.601572,On or near Cleves Walk,E01003698,Redbridge 006A,Burglary,
,2011-04,,Metropolitan Police Service,0.10249,51.605169,On or near Trentbridge Close,E01003699,Redbridge 006B,Burglary,
,2011-04,,Metropolitan Police Service,0.095778,51.602726,On or near Walden Way,E01003699,Redbridge 006B,Burglary,
,2011-04,,Metropolitan Police Service,0.104651,51.604734,On or near Wickets Way,E01003699,Redbridge 006B,Burglary,
,2011-04,,Metropolitan Police Service,0.097852,51.603858,On or near Inverness Drive,E01003699,Redbridge 006B,Burglary,
,2011-04,,Metropolitan Police Service,0.105092,51.604591,On or near Grace Close,E01003699,Redbridge 006B,Burglary,
,2011-04,,Metropolitan Police Service,0.101135,51.60459,On or near Penrith Road,E01003699,Redbridge 006B,Burglary,
,2011-04,,Metropolitan Police Service,0.081648,51.596574,On or near Mossford Lane,E01003700,Redbridge 006C,Burglary,
,2011-04,,Metropolitan Police Service,0.084223,51.588471,On or near Cranbourne Gardens,E01003701,Redbridge 006D,Burglary,
,2011-04,,Metropolitan Police Service,0.086909,51.592911,On or near Starch House Lane,E01003701,Redbridge 006D,Burglary,
,2011-04,,Metropolitan Police Service,0.082641,51.588931,On or near Sandringham Close,E01003701,Redbridge 006D,Burglary,
,2011-04,,Metropolitan Police Service,0.084402,51.604682,On or near Silver Birch Mews,E01003702,Redbridge 006E,Burglary,
,2011-04,,Metropolitan Police Service,0.086749,51.603273,On or near Maypole Crescent,E01003702,Redbridge 006E,Burglary,
,2011-04,,Metropolitan Police Service,0.022497,51.590837,On or near Woodford Road,E01003668,Redbridge 007A,Burglary,
,2011-04,,Metropolitan Police Service,0.01721,51.600523,On or near Fuller'S Road,E01003669,Redbridge 007B,Burglary,
,2011-04,,Metropolitan Police Service,0.021534,51.600998,On or near St Alban'S Road,E01003670,Redbridge 007C,Burglary,
,2011-04,,Metropolitan Police Service,0.026393,51.60246,On or near Fairlawn Drive,E01003671,Redbridge 007D,Burglary,
,2011-04,,Metropolitan Police Service,0.01536,51.597246,On or near Carnarvon Road,E01003673,Redbridge 007F,Burglary,
,2011-04,,Metropolitan Police Service,0.013227,51.597327,On or near Peel Road,E01003673,Redbridge 007F,Burglary,
,2011-04,,Metropolitan Police Service,0.014293,51.597264,On or near Walpole Road,E01003673,Redbridge 007F,Burglary,
,2011-04,,Metropolitan Police Service,0.022029,51.592644,On or near Bressey Grove,E01003674,Redbridge 007G,Burglary,
,2011-04,,Metropolitan Police Service,0.025739,51.594585,On or near Wavertree Road,E01003674,Redbridge 007G,Burglary,
,2011-04,,Metropolitan Police Service,0.070732,51.59371,On or near Berkeley Avenue,E01003709,Redbridge 008C,Burglary,
,2011-04,,Metropolitan Police Service,0.064435,51.592391,On or near Cottesmore Avenue,E01003709,Redbridge 008C,Burglary,
,2011-04,,Metropolitan Police Service,0.067575,51.592228,On or near Kirkland Avenue,E01003709,Redbridge 008C,Burglary,
,2011-04,,Metropolitan Police Service,0.032306,51.587736,On or near Southview Drive,E01003759,Redbridge 009A,Burglary,
,2011-04,,Metropolitan Police Service,0.032005,51.584864,On or near Colvin Gardens,E01003759,Redbridge 009A,Burglary,
,2011-04,,Metropolitan Police Service,0.035874,51.601028,On or near Grenville Gardens,E01003760,Redbridge 009B,Burglary,
,2011-04,,Metropolitan Police Service,0.034154,51.600348,On or near St Barnabas Road,E01003760,Redbridge 009B,Burglary,
,2011-04,,Metropolitan Police Service,0.034803,51.602917,On or near Broadmead Road,E01003760,Redbridge 009B,Burglary,
,2011-04,,Metropolitan Police Service,0.03576,51.597514,On or near Lynwood Close,E01003760,Redbridge 009B,Burglary,
,2011-04,,Metropolitan Police Service,0.032981,51.599631,On or near Fairview Gardens,E01003762,Redbridge 009D,Burglary,
,2011-04,,Metropolitan Police Service,0.045127,51.594213,On or near Rivington Avenue,E01003763,Redbridge 009E,Burglary,
,2011-04,,Metropolitan Police Service,0.044981,51.591913,On or near Southend Road,E01003763,Redbridge 009E,Burglary,
,2011-04,,Metropolitan Police Service,0.041745,51.593795,On or near Lechmere Approach,E01003763,Redbridge 009E,Burglary,
,2011-04,,Metropolitan Police Service,0.030819,51.590972,On or near Victoria Road,E01003764,Redbridge 009F,Burglary,
,2011-04,,Metropolitan Police Service,0.035001,51.590873,On or near Old Mill Court,E01003764,Redbridge 009F,Burglary,
,2011-04,,Metropolitan Police Service,0.028218,51.587996,On or near Hermon Hill,E01003764,Redbridge 009F,Burglary,
,2011-04,,Metropolitan Police Service,0.032863,51.593743,On or near Essex Road,E01003765,Redbridge 009G,Burglary,
,2011-04,,Metropolitan Police Service,0.028141,51.592431,On or near The Viaduct,E01003765,Redbridge 009G,Burglary,
,2011-04,,Metropolitan Police Service,0.030107,51.594744,On or near Violet Road,E01003765,Redbridge 009G,Burglary,
,2011-04,,Metropolitan Police Service,0.081683,51.593229,On or near Aintree Crescent,E01003705,Redbridge 010A,Burglary,
,2011-04,,Metropolitan Police Service,0.070611,51.596455,On or near Fullwell Avenue,E01003706,Redbridge 010B,Burglary,
,2011-04,,Metropolitan Police Service,0.069434,51.592159,On or near Purley Close,E01003711,Redbridge 010C,Burglary,
,2011-04,,Metropolitan Police Service,0.058186,51.581593,On or near Woodford Avenue,E01003651,Redbridge 012D,Burglary,
,2011-04,,Metropolitan Police Service,0.06097,51.578684,On or near Wycombe Road,E01003651,Redbridge 012D,Burglary,
,2011-04,,Metropolitan Police Service,0.087498,51.583719,On or near Duke Road,E01003639,Redbridge 013A,Burglary,
,2011-04,,Metropolitan Police Service,0.083631,51.582789,On or near Coronation Close,E01003639,Redbridge 013A,Burglary,
,2011-04,,Metropolitan Police Service,0.116712,51.592368,On or near Hainault Road,E01003640,Redbridge 013B,Burglary,
,2011-04,,Metropolitan Police Service,0.100129,51.581542,On or near Buryside Close,E01003641,Redbridge 013C,Burglary,
,2011-04,,Metropolitan Police Service,0.030141,51.583538,On or near Rodney Road,E01003774,Redbridge 014A,Burglary,
,2011-04,,Metropolitan Police Service,0.028309,51.585503,On or near Lancaster Avenue,E01003774,Redbridge 014A,Burglary,
,2011-04,,Metropolitan Police Service,0.021821,51.58861,On or near Woodford Road,E01003775,Redbridge 014B,Burglary,
,2011-04,,Metropolitan Police Service,0.017634,51.586317,On or near Laurel Way,E01003775,Redbridge 014B,Burglary,
,2011-04,,Metropolitan Police Service,0.030378,51.581412,On or near Eastway,E01003777,Redbridge 014D,Burglary,
,2011-04,,Metropolitan Police Service,0.027364,51.58114,On or near Cowley Road,E01003777,Redbridge 014D,Burglary,
,2011-04,,Metropolitan Police Service,0.023599,51.58054,On or near Hermon Hill,E01003777,Redbridge 014D,Burglary,
,2011-04,,Metropolitan Police Service,0.026666,51.576152,On or near Sheridan Mews,E01003778,Redbridge 014E,Burglary,
,2011-04,,Metropolitan Police Service,0.019663,51.577064,On or near East Row,E01003778,Redbridge 014E,Burglary,
,2011-04,,Metropolitan Police Service,0.023913,51.575588,On or near Addison Road,E01003778,Redbridge 014E,Burglary,
,2011-04,,Metropolitan Police Service,0.02091,51.578491,On or near Selworthy Close,E01003778,Redbridge 014E,Burglary,
,2011-04,,Metropolitan Police Service,0.021512,51.575144,On or near Gordon Road,E01003779,Redbridge 014F,Burglary,
,2011-04,,Metropolitan Police Service,0.017623,51.589986,On or near Broadwalk,E01003780,Redbridge 014G,Burglary,
,2011-04,,Metropolitan Police Service,0.01755,51.593216,On or near Bressey Grove,E01003780,Redbridge 014G,Burglary,
,2011-04,,Metropolitan Police Service,0.072367,51.576343,On or near Headley Drive,E01003647,Redbridge 015A,Burglary,
,2011-04,,Metropolitan Police Service,0.076714,51.579261,On or near Jefferson Close,E01003650,Redbridge 015B,Burglary,
,2011-04,,Metropolitan Police Service,0.066463,51.581402,On or near Glenwood Gardens,E01003652,Redbridge 015C,Burglary,
,2011-04,,Metropolitan Police Service,0.069744,51.578638,On or near Gaysham Avenue,E01003653,Redbridge 015D,Burglary,
,2011-04,,Metropolitan Police Service,0.073107,51.579595,On or near Cranbrook Road,E01003653,Redbridge 015D,Burglary,
,2011-04,,Metropolitan Police Service,0.083652,51.579786,On or near Horns Road,E01003643,Redbridge 017B,Burglary,
,2011-04,,Metropolitan Police Service,0.081679,51.57956,On or near Donington Avenue,E01003643,Redbridge 017B,Burglary,
,2011-04,,Metropolitan Police Service,0.081247,51.578965,On or near Emmott Avenue,E01003643,Redbridge 017B,Burglary,
,2011-04,,Metropolitan Police Service,0.084758,51.580296,On or near Chase Lane,E01003643,Redbridge 017B,Burglary,
,2011-04,,Metropolitan Police Service,0.082926,51.581588,On or near Aldwych Avenue,E01003643,Redbridge 017B,Burglary,
,2011-04,,Metropolitan Police Service,0.077726,51.576446,On or near Denham Drive,E01003644,Redbridge 017C,Burglary,
,2011-04,,Metropolitan Police Service,0.077092,51.575513,On or near Headley Drive,E01003644,Redbridge 017C,Burglary,
,2011-04,,Metropolitan Police Service,0.083971,51.577289,On or near Tring Close,E01003645,Redbridge 017D,Burglary,
,2011-04,,Metropolitan Police Service,0.086047,51.576919,On or near Buntingbridge Road,E01003645,Redbridge 017D,Burglary,
,2011-04,,Metropolitan Police Service,0.031288,51.574616,On or near Oak Hall Road,E01003789,Redbridge 018A,Burglary,
,2011-04,,Metropolitan Police Service,0.019679,51.572532,On or near Cambridge Park Road,E01003789,Redbridge 018A,Burglary,
,2011-04,,Metropolitan Police Service,0.030406,51.572635,On or near St Mary'S Avenue,E01003789,Redbridge 018A,Burglary,
,2011-04,,Metropolitan Police Service,0.036931,51.576244,On or near River Close,E01003795,Redbridge 018C,Burglary,
,2011-04,,Metropolitan Police Service,0.036652,51.572571,On or near Warren Road,E01003795,Redbridge 018C,Burglary,
,2011-04,,Metropolitan Police Service,0.034608,51.575287,On or near Redbridge Lane West,E01003795,Redbridge 018C,Burglary,
,2011-04,,Metropolitan Police Service,0.034002,51.580126,On or near Gloucester Road,E01003795,Redbridge 018C,Burglary,
,2011-04,,Metropolitan Police Service,0.031861,51.575172,On or near Chester Road,E01003796,Redbridge 018D,Burglary,
,2011-04,,Metropolitan Police Service,0.033996,51.573211,On or near Langley Crescent,E01003796,Redbridge 018D,Burglary,
,2011-04,,Metropolitan Police Service,0.032531,51.573038,On or near Langley Drive,E01003796,Redbridge 018D,Burglary,
,2011-04,,Metropolitan Police Service,0.12498,51.570294,On or near Hickman Road,E01003661,Redbridge 019A,Burglary,
,2011-04,,Metropolitan Police Service,0.1288,51.571448,On or near Edith Road,E01003662,Redbridge 019B,Burglary,
,2011-04,,Metropolitan Police Service,0.127557,51.569241,On or near Birchdale Gardens,E01003662,Redbridge 019B,Burglary,
,2011-04,,Metropolitan Police Service,0.129048,51.57799,On or near Norbury Gardens,E01003664,Redbridge 019D,Burglary,
,2011-04,,Metropolitan Police Service,0.116909,51.577967,On or near Heathfield Park Drive,E01033592,Redbridge 019I,Burglary,
,2011-04,,Metropolitan Police Service,0.093375,51.574963,On or near Hertford Road,E01003751,Redbridge 020A,Burglary,
,2011-04,,Metropolitan Police Service,0.086212,51.572645,On or near Clifton Road,E01003753,Redbridge 020B,Burglary,
,2011-04,,Metropolitan Police Service,0.092954,51.57114,On or near St Johns Road,E01003754,Redbridge 020C,Burglary,
,2011-04,,Metropolitan Police Service,0.092933,51.571932,On or near Devonshire Road,E01003754,Redbridge 020C,Burglary,
,2011-04,,Metropolitan Police Service,0.092715,51.573473,On or near Church Road,E01003754,Redbridge 020C,Burglary,
,2011-04,,Metropolitan Police Service,0.092889,51.566582,On or near Durban Road,E01003757,Redbridge 020D,Burglary,
,2011-04,,Metropolitan Police Service,0.092331,51.568876,On or near Kimberley Avenue,E01003757,Redbridge 020D,Burglary,
,2011-04,,Metropolitan Police Service,0.106248,51.565893,On or near High Road,E01003769,Redbridge 022A,Burglary,
,2011-04,,Metropolitan Police Service,0.115548,51.571967,On or near Mannin Road,E01003770,Redbridge 022B,Burglary,
,2011-04,,Metropolitan Police Service,0.113955,51.576824,On or near Gresham Drive,E01003770,Redbridge 022B,Burglary,
,2011-04,,Metropolitan Police Service,0.108826,51.568607,On or near Wellwood Road,E01003771,Redbridge 022C,Burglary,
,2011-04,,Metropolitan Police Service,0.109217,51.572072,On or near Erin Close,E01003771,Redbridge 022C,Burglary,
,2011-04,,Metropolitan Police Service,0.109805,51.57198,On or near Douglas Road,E01003771,Redbridge 022C,Burglary,
,2011-04,,Metropolitan Police Service,0.110125,51.569223,On or near Eastwood Road,E01003773,Redbridge 022D,Burglary,
,2011-04,,Metropolitan Police Service,0.11581,51.570775,On or near Primrose Avenue,E01003773,Redbridge 022D,Burglary,
,2011-04,,Metropolitan Police Service,0.077328,51.57309,On or near Milton Crescent,E01003752,Redbridge 023A,Burglary,
,2011-04,,Metropolitan Police Service,0.072637,51.574351,On or near Lynton Crescent,E01003752,Redbridge 023A,Burglary,
,2011-04,,Metropolitan Police Service,0.079936,51.57174,On or near Westernville Gardens,E01003755,Redbridge 023B,Burglary,
,2011-04,,Metropolitan Police Service,0.089587,51.570409,On or near Wards Road,E01003756,Redbridge 023C,Burglary,
,2011-04,,Metropolitan Police Service,0.084975,51.569582,On or near Raymond Road,E01003756,Redbridge 023C,Burglary,
,2011-04,,Metropolitan Police Service,0.089959,51.569404,On or near Mafeking Avenue,E01003756,Redbridge 023C,Burglary,
,2011-04,,Metropolitan Police Service,0.082582,51.566486,On or near Thorold Road,E01003756,Redbridge 023C,Burglary,
,2011-04,,Metropolitan Police Service,0.081774,51.563012,On or near Carriage Mews,E01003758,Redbridge 023D,Burglary,
,2011-04,,Metropolitan Police Service,0.081902,51.566435,On or near Dunedin Road,E01003758,Redbridge 023D,Burglary,
,2011-04,,Metropolitan Police Service,0.095624,51.564555,On or near Cameron Road,E01003768,Redbridge 024C,Burglary,
,2011-04,,Metropolitan Police Service,0.09674,51.567808,On or near Elgin Road,E01003768,Redbridge 024C,Burglary,
,2011-04,,Metropolitan Police Service,0.074643,51.56356,On or near Wellesley Road,E01003781,Redbridge 026A,Burglary,
,2011-04,,Metropolitan Police Service,0.068796,51.564122,On or near Park Avenue,E01003781,Redbridge 026A,Burglary,
,2011-04,,Metropolitan Police Service,0.07145,51.565685,On or near Valentines Road,E01003781,Redbridge 026A,Burglary,
,2011-04,,Metropolitan Police Service,0.041929,51.563451,On or near Clavering Road,E01003790,Redbridge 027A,Burglary,
,2011-04,,Metropolitan Police Service,0.043734,51.563159,On or near Sunderland Way,E01003790,Redbridge 027A,Burglary,
,2011-04,,Metropolitan Police Service,0.021825,51.571461,On or near Woodcote Road,E01003791,Redbridge 027B,Burglary,
,2011-04,,Metropolitan Police Service,0.023974,51.565264,On or near Blake Hall Crescent,E01003791,Redbridge 027B,Burglary,
,2011-04,,Metropolitan Police Service,0.02508,51.569705,On or near Overton Drive,E01003791,Redbridge 027B,Burglary,
,2011-04,,Metropolitan Police Service,0.024523,51.5669,On or near Blake Hall Road,E01003791,Redbridge 027B,Burglary,
,2011-04,,Metropolitan Police Service,0.022796,51.564088,On or near Windsor Road,E01003791,Redbridge 027B,Burglary,
,2011-04,,Metropolitan Police Service,0.026926,51.563522,On or near Alders Close,E01003793,Redbridge 027D,Burglary,
,2011-04,,Metropolitan Police Service,0.030095,51.563719,On or near Burden Way,E01003793,Redbridge 027D,Burglary,
,2011-04,,Metropolitan Police Service,0.075946,51.561136,On or near Hainault Street,E01003783,Redbridge 029A,Burglary,
,2011-04,,Metropolitan Police Service,0.070111,51.560997,On or near Heron Mews,E01003783,Redbridge 029A,Burglary,
,2011-04,,Metropolitan Police Service,0.071815,51.561335,On or near Balfour Road,E01003783,Redbridge 029A,Burglary,
,2011-04,,Metropolitan Police Service,0.062128,51.55835,On or near A406,E01003785,Redbridge 029C,Burglary,
,2011-04,,Metropolitan Police Service,0.062687,51.563043,On or near Empress Avenue,E01003788,Redbridge 029D,Burglary,
,2011-04,,Metropolitan Police Service,0.083805,51.555053,On or near Sunnyside Road,E01003683,Redbridge 030A,Burglary,
,2011-04,,Metropolitan Police Service,0.083603,51.55253,On or near Henley Road,E01003683,Redbridge 030A,Burglary,
,2011-04,,Metropolitan Police Service,0.087331,51.553596,On or near Gordon Road,E01003684,Redbridge 030B,Burglary,
,2011-04,,Metropolitan Police Service,0.084965,51.551084,On or near Chertsey Road,E01003684,Redbridge 030B,Burglary,
,2011-04,,Metropolitan Police Service,0.074629,51.555647,On or near Bedford Road,E01003689,Redbridge 030G,Burglary,
,2011-04,,Metropolitan Police Service,0.073573,51.557168,On or near Handforth Road,E01003689,Redbridge 030G,Burglary,
,2011-04,,Metropolitan Police Service,0.077677,51.560171,On or near Axon Place,E01033589,Redbridge 030H,Burglary,
,2011-04,,Metropolitan Police Service,0.084697,51.56162,On or near Francis Street,E01033589,Redbridge 030H,Burglary,
,2011-04,,Metropolitan Police Service,0.08701,51.559519,On or near Melford Road,E01033591,Redbridge 030I,Burglary,
,2011-04,,Metropolitan Police Service,0.084934,51.560168,On or near Connaught Road,E01033591,Redbridge 030I,Burglary,
,2011-04,,Metropolitan Police Service,0.086357,51.562265,On or near Francis Avenue,E01033591,Redbridge 030I,Burglary,
,2011-04,,Metropolitan Police Service,0.104184,51.557135,On or near Westrow Gardens,E01003737,Redbridge 031A,Burglary,
,2011-04,,Metropolitan Police Service,0.102944,51.551528,On or near Sandhurst Drive,E01003738,Redbridge 031B,Burglary,
,2011-04,,Metropolitan Police Service,0.101144,51.552846,On or near Dawlish Drive,E01003738,Redbridge 031B,Burglary,
,2011-04,,Metropolitan Police Service,0.091562,51.551498,On or near Craigen Gardens,E01003739,Redbridge 031C,Burglary,
,2011-04,,Metropolitan Police Service,0.089603,51.55093,On or near St Francis Way,E01003739,Redbridge 031C,Burglary,
,2011-04,,Metropolitan Police Service,0.097331,51.555244,On or near Water Lane,E01003740,Redbridge 031D,Burglary,
,2011-04,,Metropolitan Police Service,0.09722,51.559427,On or near Guildford Road,E01003742,Redbridge 031F,Burglary,
,2011-04,,Metropolitan Police Service,0.098556,51.560554,On or near Hobbs Mews,E01003742,Redbridge 031F,Burglary,
,2011-04,,Metropolitan Police Service,0.088518,51.55496,On or near Littlemoor Road,E01003743,Redbridge 031G,Burglary,
,2011-04,,Metropolitan Police Service,0.068828,51.5553,On or near Riverdene Road,E01003728,Redbridge 032A,Burglary,
,2011-04,,Metropolitan Police Service,0.076501,51.552422,On or near Kingston Road,E01003730,Redbridge 032C,Burglary,
,2011-04,,Metropolitan Police Service,0.070044,51.546493,On or near Lavender Place,E01003732,Redbridge 032D,Burglary,
,2011-04,,Metropolitan Police Service,0.07084,51.550354,On or near Paget Road,E01003733,Redbridge 032E,Burglary,
,2011-04,,Metropolitan Police Service,0.069788,51.549114,On or near Daffodil Gardens,E01003733,Redbridge 032E,Burglary,
,2011-04,,Metropolitan Police Service,0.074325,51.548018,On or near Khartoum Road,E01003733,Redbridge 032E,Burglary,
,2011-04,,Metropolitan Police Service,0.079443,51.550193,On or near Eton Road,E01003731,Redbridge 033A,Burglary,
,2011-04,,Metropolitan Police Service,0.078217,51.549235,On or near Tylehurst Gardens,E01003731,Redbridge 033A,Burglary,
,2011-04,,Metropolitan Police Service,0.077552,51.55047,On or near Mortlake Road,E01003731,Redbridge 033A,Burglary,
,2011-04,,Metropolitan Police Service,0.074573,51.547438,On or near Hunters Road,E01003734,Redbridge 033B,Burglary,
,2011-04,,Metropolitan Police Service,0.085514,51.548575,On or near Lawson Close,E01003735,Redbridge 033C,Burglary,
,2011-04,,Metropolitan Police Service,0.104052,51.560843,On or near Lynford Gardens,E01003713,Redbridge 034A,Burglary,
,2011-04,,Metropolitan Police Service,0.094912,51.560673,On or near Kent View Gardens,E01003714,Redbridge 034B,Burglary,
,2011-04,,Metropolitan Police Service,0.10058,51.563773,On or near Vernon Road,E01003715,Redbridge 034C,Burglary,
,2011-04,,Metropolitan Police Service,0.103125,51.56326,On or near Felbrigge Road,E01003715,Redbridge 034C,Burglary,
,2011-04,,Metropolitan Police Service,0.112565,51.56024,On or near Abbotsford Road,E01003716,Redbridge 034D,Burglary,
,2011-04,,Metropolitan Police Service,0.114304,51.564444,On or near Kinfauns Road,E01003718,Redbridge 034E,Burglary,
,2011-04,,Metropolitan Police Service,0.11691,51.561843,On or near Colinton Road,E01003719,Redbridge 034F,Burglary,
,2011-04,,Metropolitan Police Service,0.125032,51.564295,On or near Burnside,E01032581,Redbridge 034G,Burglary,
,2011-04,,Metropolitan Police Service,0.126343,51.566097,On or near Plowman Way,E01032581,Redbridge 034G,Burglary,
,2011-04,,Metropolitan Police Service,0.121639,51.563619,On or near Greenside,E01032581,Redbridge 034G,Burglary,
,2011-04,,Metropolitan Police Service,0.065092,51.570258,On or near Bethell Avenue,E01003690,Redbridge 035A,Burglary,
,2011-04,,Metropolitan Police Service,0.057279,51.565026,On or near Belgrave Road,E01003691,Redbridge 035B,Burglary,
,2011-04,,Metropolitan Police Service,0.052088,51.572149,On or near Ely Gardens,E01003693,Redbridge 035D,Burglary,
,2011-04,,Metropolitan Police Service,0.052522,51.569921,On or near Truro Gardens,E01003693,Redbridge 035D,Burglary,
,2011-04,,Metropolitan Police Service,0.051166,51.571536,On or near Wells Gardens,E01003693,Redbridge 035D,Burglary,
,2011-04,,Metropolitan Police Service,0.056854,51.575411,On or near Castleview Gardens,E01003696,Redbridge 035G,Burglary,
,2011-04,,Metropolitan Police Service,0.056284,51.574621,On or near Devonport Gardens,E01003696,Redbridge 035G,Burglary,
,2011-04,,Metropolitan Police Service,0.053167,51.576231,On or near Eastern Avenue,E01003696,Redbridge 035G,Burglary,
,2011-04,,Metropolitan Police Service,0.048507,51.575315,On or near Evanston Gardens,E01003697,Redbridge 035H,Burglary,
,2011-04,,Metropolitan Police Service,0.048326,51.573852,On or near Carlisle Gardens,E01003697,Redbridge 035H,Burglary,
,2011-04,,Metropolitan Police Service,0.049382,51.576783,On or near Margaret Way,E01003675,Redbridge 036A,Burglary,
,2011-04,,Metropolitan Police Service,0.046827,51.579346,On or near Vista Drive,E01003675,Redbridge 036A,Burglary,
,2011-04,,Metropolitan Police Service,0.051656,51.577607,On or near Redbridge Lane East,E01003676,Redbridge 036B,Burglary,
,2011-04,,Metropolitan Police Service,0.045386,51.581007,On or near Mighell Avenue,E01003677,Redbridge 036C,Burglary,
,2011-04,,Metropolitan Police Service,0.044868,51.585872,On or near Carswell Close,E01003677,Redbridge 036C,Burglary,
,2011-04,,Metropolitan Police Service,0.065759,51.590066,On or near Tiverton Avenue,E01003680,Redbridge 036F,Burglary,
,2011-04,,Metropolitan Police Service,0.057304,51.58284,On or near Woodford Avenue,E01003681,Redbridge 036G,Burglary,
,2011-04,,Metropolitan Police Service,0.053414,51.585561,On or near Lodge Hill,E01003681,Redbridge 036G,Burglary,
,2011-04,,Metropolitan Police Service,0.047493,51.583884,On or near Torquay Gardens,E01003682,Redbridge 036H,Burglary,
