Crime ID,Month,Reported by,Falls within,Longitude,Latitude,Location,LSOA code,LSOA name,Crime type,Last outcome category
,2011-04,,Metropolitan Police Service,-0.097497,51.309108,On or near Golf Road,E01001072,Croydon 042C,Burglary,
,2011-04,,Metropolitan Police Service,-0.106091,51.313654,On or near Hayes Lane,E01001072,Croydon 042C,Burglary,
,2011-04,,Metropolitan Police Service,-0.100775,51.33328,On or near Lower Barn Road,E01001104,Croydon 042D,Burglary,
,2011-04,,Metropolitan Police Service,-0.150697,51.3188,On or near Chipstead Valley Road,E01001025,Croydon 043C,Burglary,
,2011-04,,Metropolitan Police Service,-0.155925,51.314054,On or near Ridgemount Avenue,E01001027,Croydon 043E,Burglary,
,2011-04,,Metropolitan Police Service,-0.146594,51.318771,On or near Coniston Road,E01001027,Croydon 043E,Burglary,
,2011-04,,Metropolitan Police Service,-0.155483,51.310396,On or near Rickman Hill Road,E01001027,Croydon 043E,Burglary,
,2011-04,,Metropolitan Police Service,-0.111403,51.305547,On or near Margaret Way,E01001018,Croydon 044A,Burglary,
,2011-04,,Metropolitan Police Service,-0.116458,51.301591,On or near Thorncroft Close,E01001020,Croydon 044C,Burglary,
,2011-04,,Metropolitan Police Service,-0.109039,51.295014,On or near Old Fox Close,E01001022,Croydon 044E,Burglary,
,2011-04,,Metropolitan Police Service,-0.103227,51.300289,On or near Rydon'S Wood Close,E01001022,Croydon 044E,Burglary,
,2011-04,,Metropolitan Police Service,-0.064429,51.399996,On or near Malden Avenue,E01001190,Croydon 045C,Burglary,
,2011-04,,Metropolitan Police Service,-0.066261,51.39848,On or near Archer Road,E01001190,Croydon 045C,Burglary,
,2011-04,,Metropolitan Police Service,-0.053318,51.394542,On or near Milford Gardens,E01032569,Croydon 045E,Burglary,
,2011-04,,Metropolitan Police Service,-0.051769,51.393779,On or near Kingfisher Way,E01032569,Croydon 045E,Burglary,
,2011-04,,Metropolitan Police Service,-0.05363,51.392605,On or near Longheath Gardens,E01032569,Croydon 045E,Burglary,
,2011-04,,Metropolitan Police Service,-0.339887,51.552083,On or near Oldfield Close,E01001269,Ealing 001A,Burglary,
,2011-04,,Metropolitan Police Service,-0.345274,51.550316,On or near Clare Road,E01001269,Ealing 001A,Burglary,
,2011-04,,Metropolitan Police Service,-0.341942,51.551887,On or near Malden Avenue,E01001269,Ealing 001A,Burglary,
,2011-04,,Metropolitan Police Service,-0.343332,51.550154,On or near Rugby Avenue,E01001269,Ealing 001A,Burglary,
,2011-04,,Metropolitan Police Service,-0.348498,51.549696,On or near Rothesay Avenue,E01001271,Ealing 001B,Burglary,
,2011-04,,Metropolitan Police Service,-0.351115,51.556693,On or near Killowen Avenue,E01001309,Ealing 001C,Burglary,
,2011-04,,Metropolitan Police Service,-0.352188,51.557742,On or near Halsbury Road East,E01001309,Ealing 001C,Burglary,
,2011-04,,Metropolitan Police Service,-0.353191,51.556335,On or near Russell Road,E01001309,Ealing 001C,Burglary,
,2011-04,,Metropolitan Police Service,-0.356713,51.555081,On or near Reading Road,E01001310,Ealing 001D,Burglary,
,2011-04,,Metropolitan Police Service,-0.358483,51.556796,On or near Halsbury Road West,E01001310,Ealing 001D,Burglary,
,2011-04,,Metropolitan Police Service,-0.348778,51.555095,On or near Ramsey Close,E01001311,Ealing 001E,Burglary,
,2011-04,,Metropolitan Police Service,-0.345327,51.554795,On or near Hammond Close,E01001311,Ealing 001E,Burglary,
,2011-04,,Metropolitan Police Service,-0.335826,51.552286,On or near Sherwood Avenue,E01001307,Ealing 002A,Burglary,
,2011-04,,Metropolitan Police Service,-0.337741,51.548438,On or near Berkeley Avenue,E01001307,Ealing 002A,Burglary,
,2011-04,,Metropolitan Police Service,-0.338283,51.553346,On or near Greenford Road,E01001312,Ealing 002C,Burglary,
,2011-04,,Metropolitan Police Service,-0.328471,51.550689,On or near Robin Hood Way,E01001314,Ealing 002E,Burglary,
,2011-04,,Metropolitan Police Service,-0.332091,51.552278,On or near Melville Avenue,E01001314,Ealing 002E,Burglary,
,2011-04,,Metropolitan Police Service,-0.329481,51.553833,On or near Northwood Gardens,E01001314,Ealing 002E,Burglary,
,2011-04,,Metropolitan Police Service,-0.356676,51.552895,On or near Grainger Close,E01001315,Ealing 003A,Burglary,
,2011-04,,Metropolitan Police Service,-0.360298,51.554852,On or near Pett'S Hill,E01001315,Ealing 003A,Burglary,
,2011-04,,Metropolitan Police Service,-0.361607,51.553764,On or near Bangor Close,E01001316,Ealing 003B,Burglary,
,2011-04,,Metropolitan Police Service,-0.360916,51.550895,On or near Holmwood Close,E01001316,Ealing 003B,Burglary,
,2011-04,,Metropolitan Police Service,-0.371585,51.550225,On or near Fakenham Close,E01001317,Ealing 003C,Burglary,
,2011-04,,Metropolitan Police Service,-0.36411,51.551533,On or near Cheltenham Close,E01001318,Ealing 003D,Burglary,
,2011-04,,Metropolitan Police Service,-0.383331,51.546404,On or near Lordship Road,E01001320,Ealing 003E,Burglary,
,2011-04,,Metropolitan Police Service,-0.377685,51.544168,On or near Harewood Avenue,E01001321,Ealing 003F,Burglary,
,2011-04,,Metropolitan Police Service,-0.357343,51.547599,On or near Castle Road,E01001270,Ealing 004A,Burglary,
,2011-04,,Metropolitan Police Service,-0.353381,51.549881,On or near The Fairway,E01001270,Ealing 004A,Burglary,
,2011-04,,Metropolitan Police Service,-0.353671,51.548222,On or near Carr Road,E01001270,Ealing 004A,Burglary,
,2011-04,,Metropolitan Police Service,-0.359119,51.549152,On or near Gonville Crescent,E01001319,Ealing 004B,Burglary,
,2011-04,,Metropolitan Police Service,-0.359489,51.550075,On or near Siverst Close,E01001319,Ealing 004B,Burglary,
,2011-04,,Metropolitan Police Service,-0.360755,51.549382,On or near Ribblesdale Avenue,E01001319,Ealing 004B,Burglary,
,2011-04,,Metropolitan Police Service,-0.357976,51.550045,On or near Blenheim Road,E01001319,Ealing 004B,Burglary,
,2011-04,,Metropolitan Police Service,-0.362748,51.547683,On or near Carr Road,E01001322,Ealing 004C,Burglary,
,2011-04,,Metropolitan Police Service,-0.366486,51.548419,On or near Badminton Close,E01001322,Ealing 004C,Burglary,
,2011-04,,Metropolitan Police Service,-0.36018,51.546901,On or near Oriel Way,E01001322,Ealing 004C,Burglary,
,2011-04,,Metropolitan Police Service,-0.367685,51.545153,On or near Court Farm Road,E01001322,Ealing 004C,Burglary,
,2011-04,,Metropolitan Police Service,-0.372305,51.544184,On or near Vicarage Close,E01001323,Ealing 004D,Burglary,
,2011-04,,Metropolitan Police Service,-0.371187,51.544411,On or near Church Road,E01001323,Ealing 004D,Burglary,
,2011-04,,Metropolitan Police Service,-0.370266,51.548382,On or near The Farmlands,E01001323,Ealing 004D,Burglary,
,2011-04,,Metropolitan Police Service,-0.312954,51.535396,On or near Wadsworth Close,E01001341,Ealing 005A,Burglary,
,2011-04,,Metropolitan Police Service,-0.314751,51.541006,On or near Lynmouth Road,E01001341,Ealing 005A,Burglary,
,2011-04,,Metropolitan Police Service,-0.312795,51.542039,On or near Jordan Road,E01001342,Ealing 005B,Burglary,
,2011-04,,Metropolitan Police Service,-0.315508,51.540046,On or near Bilton Road,E01001343,Ealing 005C,Burglary,
,2011-04,,Metropolitan Police Service,-0.317139,51.543135,On or near Woodrow Close,E01001343,Ealing 005C,Burglary,
,2011-04,,Metropolitan Police Service,-0.31725,51.541689,On or near George V Way,E01001343,Ealing 005C,Burglary,
,2011-04,,Metropolitan Police Service,-0.355685,51.541578,On or near Stanley Avenue,E01001265,Ealing 006A,Burglary,
,2011-04,,Metropolitan Police Service,-0.343372,51.538347,On or near Middleton Avenue,E01001266,Ealing 006B,Burglary,
,2011-04,,Metropolitan Police Service,-0.347691,51.536538,On or near Karoline Gardens,E01001267,Ealing 006C,Burglary,
,2011-04,,Metropolitan Police Service,-0.353179,51.535086,On or near Ormsby Gardens,E01001267,Ealing 006C,Burglary,
,2011-04,,Metropolitan Police Service,-0.351675,51.543599,On or near Allington Close,E01001272,Ealing 006D,Burglary,
,2011-04,,Metropolitan Police Service,-0.345218,51.535541,On or near Blenheim Close,E01001349,Ealing 006E,Burglary,
,2011-04,,Metropolitan Police Service,-0.342629,51.534182,On or near Anthony Road,E01001349,Ealing 006E,Burglary,
,2011-04,,Metropolitan Police Service,-0.341331,51.5342,On or near David Avenue,E01001349,Ealing 006E,Burglary,
,2011-04,,Metropolitan Police Service,-0.322416,51.535711,On or near Tavistock Avenue,E01001344,Ealing 007A,Burglary,
,2011-04,,Metropolitan Police Service,-0.324647,51.541705,On or near Horsenden Lane North,E01001344,Ealing 007A,Burglary,
,2011-04,,Metropolitan Police Service,-0.326201,51.538265,On or near Selborne Gardens,E01001344,Ealing 007A,Burglary,
,2011-04,,Metropolitan Police Service,-0.321522,51.534925,On or near Rockford Avenue,E01001347,Ealing 007C,Burglary,
,2011-04,,Metropolitan Police Service,-0.322006,51.534312,On or near Dawlish Avenue,E01001347,Ealing 007C,Burglary,
,2011-04,,Metropolitan Police Service,-0.330397,51.537858,On or near Woodhouse Avenue,E01001348,Ealing 007D,Burglary,
,2011-04,,Metropolitan Police Service,-0.377234,51.532121,On or near Brunel Close,E01001257,Ealing 008A,Burglary,
,2011-04,,Metropolitan Police Service,-0.379247,51.540809,On or near Canford Avenue,E01001324,Ealing 008B,Burglary,
,2011-04,,Metropolitan Police Service,-0.407385,51.534908,On or near Longhook Gardens,E01001325,Ealing 009A,Burglary,
,2011-04,,Metropolitan Police Service,-0.409911,51.535248,On or near Bankside Avenue,E01001325,Ealing 009A,Burglary,
,2011-04,,Metropolitan Police Service,-0.395926,51.536434,On or near Watery Lane,E01001327,Ealing 009B,Burglary,
,2011-04,,Metropolitan Police Service,-0.392882,51.536068,On or near Tangmere Gardens,E01001327,Ealing 009B,Burglary,
,2011-04,,Metropolitan Police Service,-0.400057,51.533766,On or near Gurney Road,E01001329,Ealing 009D,Burglary,
,2011-04,,Metropolitan Police Service,-0.396412,51.538194,On or near Old Ruislip Road,E01001329,Ealing 009D,Burglary,
,2011-04,,Metropolitan Police Service,-0.365477,51.531086,On or near Allenby Close,E01001258,Ealing 010B,Burglary,
,2011-04,,Metropolitan Police Service,-0.364939,51.53365,On or near Greenway Gardens,E01001258,Ealing 010B,Burglary,
,2011-04,,Metropolitan Police Service,-0.37331,51.537453,On or near Hazelmere Drive,E01001263,Ealing 010D,Burglary,
,2011-04,,Metropolitan Police Service,-0.374306,51.537809,On or near Hazelmere Close,E01001263,Ealing 010D,Burglary,
,2011-04,,Metropolitan Police Service,-0.376093,51.53581,On or near Greenhill Gardens,E01001263,Ealing 010D,Burglary,
,2011-04,,Metropolitan Police Service,-0.358956,51.534817,On or near Ferrymead Gardens,E01001264,Ealing 010E,Burglary,
,2011-04,,Metropolitan Police Service,-0.359752,51.536752,On or near Melrose Avenue,E01001264,Ealing 010E,Burglary,
,2011-04,,Metropolitan Police Service,-0.286911,51.533939,On or near Brentmead Gardens,E01001276,Ealing 011A,Burglary,
,2011-04,,Metropolitan Police Service,-0.283126,51.533749,On or near Twyford Abbey Road,E01001276,Ealing 011A,Burglary,
,2011-04,,Metropolitan Police Service,-0.283871,51.537726,On or near Abbeydale Road,E01001276,Ealing 011A,Burglary,
,2011-04,,Metropolitan Police Service,-0.29026,51.533071,On or near Park Avenue,E01001276,Ealing 011A,Burglary,
,2011-04,,Metropolitan Police Service,-0.290277,51.534924,On or near Brent Crescent,E01001277,Ealing 011B,Burglary,
,2011-04,,Metropolitan Police Service,-0.285209,51.527053,On or near Hanger Green,E01001278,Ealing 011C,Burglary,
,2011-04,,Metropolitan Police Service,-0.289835,51.523236,On or near Dallas Road,E01001278,Ealing 011C,Burglary,
,2011-04,,Metropolitan Police Service,-0.303016,51.523859,On or near Helena Road,E01001280,Ealing 011D,Burglary,
,2011-04,,Metropolitan Police Service,-0.300201,51.523585,On or near Nichols Green,E01001280,Ealing 011D,Burglary,
,2011-04,,Metropolitan Police Service,-0.357216,51.520288,On or near Queen'S Avenue,E01001218,Ealing 012A,Burglary,
,2011-04,,Metropolitan Police Service,-0.345866,51.532376,On or near Costons Avenue,E01001260,Ealing 012B,Burglary,
,2011-04,,Metropolitan Police Service,-0.346986,51.530116,On or near Wedmore Road,E01001260,Ealing 012B,Burglary,
,2011-04,,Metropolitan Police Service,-0.349878,51.529078,On or near Locarno Road,E01001260,Ealing 012B,Burglary,
,2011-04,,Metropolitan Police Service,-0.3545,51.53006,On or near Oldfield Lane South,E01001261,Ealing 012C,Burglary,
,2011-04,,Metropolitan Police Service,-0.354205,51.524643,On or near Stanhope Road,E01001261,Ealing 012C,Burglary,
,2011-04,,Metropolitan Police Service,-0.311474,51.527866,On or near North View,E01001209,Ealing 013A,Burglary,
,2011-04,,Metropolitan Police Service,-0.314166,51.525234,On or near Glencairn Drive,E01001209,Ealing 013A,Burglary,
,2011-04,,Metropolitan Police Service,-0.301031,51.526843,On or near Brookfield Avenue,E01001279,Ealing 013C,Burglary,
,2011-04,,Metropolitan Police Service,-0.306713,51.523679,On or near Park Gate,E01001281,Ealing 013D,Burglary,
,2011-04,,Metropolitan Police Service,-0.361705,51.524118,On or near Mansell Road,E01001217,Ealing 014A,Burglary,
,2011-04,,Metropolitan Police Service,-0.363441,51.522335,On or near Keats Way,E01001217,Ealing 014A,Burglary,
,2011-04,,Metropolitan Police Service,-0.366635,51.520491,On or near Allenby Road,E01001217,Ealing 014A,Burglary,
,2011-04,,Metropolitan Police Service,-0.360889,51.528378,On or near Mornington Road,E01001259,Ealing 014B,Burglary,
,2011-04,,Metropolitan Police Service,-0.363688,51.526709,On or near Upper Town Road,E01001291,Ealing 014C,Burglary,
,2011-04,,Metropolitan Police Service,-0.363939,51.52816,On or near Avon Road,E01001291,Ealing 014C,Burglary,
,2011-04,,Metropolitan Police Service,-0.361078,51.525521,On or near Fermoy Road,E01001292,Ealing 014D,Burglary,
,2011-04,,Metropolitan Police Service,-0.369289,51.526895,On or near Selby Gardens,E01001293,Ealing 014E,Burglary,
,2011-04,,Metropolitan Police Service,-0.367415,51.526086,On or near Bycroft Road,E01001293,Ealing 014E,Burglary,
,2011-04,,Metropolitan Police Service,-0.261461,51.517703,On or near Western Avenue,E01001196,Ealing 015A,Burglary,
,2011-04,,Metropolitan Police Service,-0.26399,51.519799,On or near Leamington Park,E01001238,Ealing 015B,Burglary,
,2011-04,,Metropolitan Police Service,-0.259741,51.521229,On or near Acorn Gardens,E01001239,Ealing 015C,Burglary,
,2011-04,,Metropolitan Police Service,-0.265037,51.530579,On or near Acton Lane,E01001246,Ealing 015D,Burglary,
,2011-04,,Metropolitan Police Service,-0.263863,51.529212,On or near Minerva Road,E01001246,Ealing 015D,Burglary,
,2011-04,,Metropolitan Police Service,-0.262432,51.531961,On or near Wesley Avenue,E01001246,Ealing 015D,Burglary,
,2011-04,,Metropolitan Police Service,-0.260163,51.532116,On or near North Acton Road,E01001246,Ealing 015D,Burglary,
,2011-04,,Metropolitan Police Service,-0.266745,51.526602,On or near Park Royal Road,E01001247,Ealing 015E,Burglary,
,2011-04,,Metropolitan Police Service,-0.27044,51.527223,On or near Western Road,E01001247,Ealing 015E,Burglary,
,2011-04,,Metropolitan Police Service,-0.328348,51.528072,On or near Brentside Close,E01001210,Ealing 016A,Burglary,
,2011-04,,Metropolitan Police Service,-0.328122,51.527547,On or near Argyle Close,E01001210,Ealing 016A,Burglary,
,2011-04,,Metropolitan Police Service,-0.339149,51.523621,On or near Hillyard Road,E01001283,Ealing 016C,Burglary,
,2011-04,,Metropolitan Police Service,-0.335029,51.51841,On or near Homefarm Road,E01001286,Ealing 016E,Burglary,
,2011-04,,Metropolitan Police Service,-0.374382,51.519088,On or near Denbigh Road,E01001297,Ealing 017D,Burglary,
,2011-04,,Metropolitan Police Service,-0.375682,51.519825,On or near Tring Avenue,E01001297,Ealing 017D,Burglary,
,2011-04,,Metropolitan Police Service,-0.370021,51.517301,On or near Mount Avenue,E01001298,Ealing 017E,Burglary,
,2011-04,,Metropolitan Police Service,-0.326197,51.519103,On or near Kingsley Avenue,E01001204,Ealing 018A,Burglary,
,2011-04,,Metropolitan Police Service,-0.326542,51.522669,On or near Claremont Road,E01001204,Ealing 018A,Burglary,
,2011-04,,Metropolitan Police Service,-0.324465,51.521911,On or near Robinson'S Close,E01001204,Ealing 018A,Burglary,
,2011-04,,Metropolitan Police Service,-0.327778,51.516859,On or near Drayton Bridge Road,E01001205,Ealing 018B,Burglary,
,2011-04,,Metropolitan Police Service,-0.326231,51.51779,On or near Lynton Avenue,E01001205,Ealing 018B,Burglary,
,2011-04,,Metropolitan Police Service,-0.328347,51.519817,On or near Cavendish Avenue,E01001205,Ealing 018B,Burglary,
,2011-04,,Metropolitan Police Service,-0.330676,51.518411,On or near Framfield Road,E01001206,Ealing 018C,Burglary,
,2011-04,,Metropolitan Police Service,-0.332395,51.523444,On or near Bordars Road,E01001206,Ealing 018C,Burglary,
,2011-04,,Metropolitan Police Service,-0.315574,51.522629,On or near Victoria Road,E01001212,Ealing 018F,Burglary,
,2011-04,,Metropolitan Police Service,-0.320261,51.517462,On or near College Road,E01001224,Ealing 019B,Burglary,
,2011-04,,Metropolitan Police Service,-0.31441,51.519806,On or near Lakeside,E01001226,Ealing 019C,Burglary,
,2011-04,,Metropolitan Police Service,-0.316245,51.516955,On or near Waldeck Road,E01001227,Ealing 019D,Burglary,
,2011-04,,Metropolitan Police Service,-0.319471,51.516606,On or near The Avenue,E01001227,Ealing 019D,Burglary,
,2011-04,,Metropolitan Police Service,-0.316368,51.518692,On or near Montague Road,E01001227,Ealing 019D,Burglary,
,2011-04,,Metropolitan Police Service,-0.311656,51.517869,On or near Amherst Road,E01001228,Ealing 019E,Burglary,
,2011-04,,Metropolitan Police Service,-0.308316,51.515825,On or near Longfield Road,E01001228,Ealing 019E,Burglary,
,2011-04,,Metropolitan Police Service,-0.310527,51.517233,On or near Pinewood Grove,E01001228,Ealing 019E,Burglary,
,2011-04,,Metropolitan Police Service,-0.312146,51.514765,On or near Gordon Road,E01001228,Ealing 019E,Burglary,
,2011-04,,Metropolitan Police Service,-0.300757,51.51407,On or near The Mall,E01001221,Ealing 020A,Burglary,
,2011-04,,Metropolitan Police Service,-0.303616,51.519363,On or near Mount Park Road,E01001223,Ealing 020B,Burglary,
,2011-04,,Metropolitan Police Service,-0.303622,51.522312,On or near St Peter'S Way,E01001223,Ealing 020B,Burglary,
,2011-04,,Metropolitan Police Service,-0.301958,51.516273,On or near Madeley Road,E01001225,Ealing 020C,Burglary,
,2011-04,,Metropolitan Police Service,-0.30482,51.517986,On or near Mount Park Crescent,E01001225,Ealing 020C,Burglary,
,2011-04,,Metropolitan Police Service,-0.294998,51.512772,On or near North Common Road,E01001235,Ealing 020D,Burglary,
,2011-04,,Metropolitan Police Service,-0.298255,51.512361,On or near Florence Road,E01001235,Ealing 020D,Burglary,
,2011-04,,Metropolitan Police Service,-0.305553,51.510282,On or near Ealing Green,E01001236,Ealing 020E,Burglary,
,2011-04,,Metropolitan Police Service,-0.288151,51.521251,On or near Audley Road,E01001273,Ealing 020F,Burglary,
,2011-04,,Metropolitan Police Service,-0.286394,51.517377,On or near Queen'S Drive,E01001273,Ealing 020F,Burglary,
,2011-04,,Metropolitan Police Service,-0.289871,51.517275,On or near Station Road,E01001273,Ealing 020F,Burglary,
,2011-04,,Metropolitan Police Service,-0.288119,51.519039,On or near Boileau Road,E01001273,Ealing 020F,Burglary,
,2011-04,,Metropolitan Police Service,-0.283355,51.520768,On or near Vale Lane,E01001274,Ealing 020G,Burglary,
,2011-04,,Metropolitan Police Service,-0.298921,51.518099,On or near Haven Lane,E01001275,Ealing 020H,Burglary,
,2011-04,,Metropolitan Police Service,-0.295089,51.518034,On or near Woodville Gardens,E01001275,Ealing 020H,Burglary,
,2011-04,,Metropolitan Police Service,-0.274364,51.519539,On or near Moat Place,E01001195,Ealing 021A,Burglary,
,2011-04,,Metropolitan Police Service,-0.274025,51.522411,On or near Alliance Road,E01001195,Ealing 021A,Burglary,
,2011-04,,Metropolitan Police Service,-0.274261,51.513099,On or near Creswick Road,E01001197,Ealing 021B,Burglary,
,2011-04,,Metropolitan Police Service,-0.275301,51.514948,On or near Lynton Road,E01001197,Ealing 021B,Burglary,
,2011-04,,Metropolitan Police Service,-0.273701,51.513432,On or near Pierrepoint Road,E01001197,Ealing 021B,Burglary,
,2011-04,,Metropolitan Police Service,-0.265157,51.512991,On or near Crane Avenue,E01001198,Ealing 021C,Burglary,
,2011-04,,Metropolitan Police Service,-0.27107,51.513636,On or near Shalimar Gardens,E01001199,Ealing 021D,Burglary,
,2011-04,,Metropolitan Police Service,-0.339406,51.516557,On or near Elmwood Gardens,E01001288,Ealing 022B,Burglary,
,2011-04,,Metropolitan Police Service,-0.334275,51.514982,On or near Cowper Road,E01001289,Ealing 022C,Burglary,
,2011-04,,Metropolitan Police Service,-0.33106,51.515,On or near Park Road,E01001289,Ealing 022C,Burglary,
,2011-04,,Metropolitan Police Service,-0.341601,51.512874,On or near Brentmead Close,E01001290,Ealing 022D,Burglary,
,2011-04,,Metropolitan Police Service,-0.377991,51.514066,On or near South Avenue Gardens,E01001213,Ealing 023A,Burglary,
,2011-04,,Metropolitan Police Service,-0.374591,51.507158,On or near Milan Road,E01001361,Ealing 023E,Burglary,
,2011-04,,Metropolitan Police Service,-0.380084,51.511541,On or near Northcote Avenue,E01001361,Ealing 023E,Burglary,
,2011-04,,Metropolitan Police Service,-0.252074,51.518561,On or near The Bye,E01001240,Ealing 024A,Burglary,
,2011-04,,Metropolitan Police Service,-0.253207,51.514559,On or near Kingsdown Avenue,E01001240,Ealing 024A,Burglary,
,2011-04,,Metropolitan Police Service,-0.250677,51.514782,On or near Sunningdale Avenue,E01001240,Ealing 024A,Burglary,
,2011-04,,Metropolitan Police Service,-0.251795,51.516444,On or near Muirfield,E01001240,Ealing 024A,Burglary,
,2011-04,,Metropolitan Police Service,-0.25439,51.511896,On or near Beechwood Grove,E01001241,Ealing 024B,Burglary,
,2011-04,,Metropolitan Police Service,-0.253543,51.517459,On or near The Fairway,E01001241,Ealing 024B,Burglary,
,2011-04,,Metropolitan Police Service,-0.25334,51.507708,On or near Maple Avenue,E01001241,Ealing 024B,Burglary,
,2011-04,,Metropolitan Police Service,-0.260392,51.51248,On or near Perryn Road,E01001242,Ealing 024C,Burglary,
,2011-04,,Metropolitan Police Service,-0.247393,51.512089,On or near Old Oak Road,E01001243,Ealing 024D,Burglary,
,2011-04,,Metropolitan Police Service,-0.25046,51.505768,On or near Agnes Road,E01001244,Ealing 024E,Burglary,
,2011-04,,Metropolitan Police Service,-0.255327,51.508125,On or near Oak Way,E01001244,Ealing 024E,Burglary,
,2011-04,,Metropolitan Police Service,-0.26289,51.508938,On or near East Churchfield Road,E01001200,Ealing 025A,Burglary,
,2011-04,,Metropolitan Police Service,-0.265406,51.511754,On or near Cumberland Park,E01001200,Ealing 025A,Burglary,
,2011-04,,Metropolitan Police Service,-0.26396,51.50961,On or near Milton Road,E01001200,Ealing 025A,Burglary,
,2011-04,,Metropolitan Police Service,-0.2656,51.513483,On or near The Tiltwood,E01001201,Ealing 025B,Burglary,
,2011-04,,Metropolitan Police Service,-0.265537,51.510209,On or near Shakespeare Road,E01001201,Ealing 025B,Burglary,
,2011-04,,Metropolitan Police Service,-0.272515,51.508963,On or near Narrow Street,E01001202,Ealing 025C,Burglary,
,2011-04,,Metropolitan Police Service,-0.267885,51.507573,On or near Cromwell Close,E01001203,Ealing 025D,Burglary,
,2011-04,,Metropolitan Police Service,-0.272415,51.507056,On or near Mill Hill Grove,E01001351,Ealing 025E,Burglary,
,2011-04,,Metropolitan Police Service,-0.378903,51.506229,On or near The Crescent,E01001362,Ealing 026C,Burglary,
,2011-04,,Metropolitan Police Service,-0.38805,51.514088,On or near Livingstone Road,E01001363,Ealing 026D,Burglary,
,2011-04,,Metropolitan Police Service,-0.380805,51.512343,On or near Alfred Gardens,E01001364,Ealing 026E,Burglary,
,2011-04,,Metropolitan Police Service,-0.288495,51.505169,On or near Kingsbridge Avenue,E01001231,Ealing 027A,Burglary,
,2011-04,,Metropolitan Police Service,-0.291545,51.502579,On or near Baronsmede,E01001231,Ealing 027A,Burglary,
,2011-04,,Metropolitan Police Service,-0.288001,51.501799,On or near Gunnersbury Drive,E01001231,Ealing 027A,Burglary,
,2011-04,,Metropolitan Police Service,-0.290455,51.513237,On or near Freeland Road,E01001234,Ealing 027B,Burglary,
,2011-04,,Metropolitan Police Service,-0.283636,51.513677,On or near Montague Gardens,E01001350,Ealing 027C,Burglary,
,2011-04,,Metropolitan Police Service,-0.284417,51.514363,On or near Oakley Avenue,E01001350,Ealing 027C,Burglary,
,2011-04,,Metropolitan Police Service,-0.282968,51.511896,On or near Layer Gardens,E01001350,Ealing 027C,Burglary,
,2011-04,,Metropolitan Police Service,-0.285734,51.51154,On or near Fordhook Avenue,E01001352,Ealing 027D,Burglary,
,2011-04,,Metropolitan Police Service,-0.282777,51.50969,On or near Hale Gardens,E01001352,Ealing 027D,Burglary,
,2011-04,,Metropolitan Police Service,-0.28284,51.510698,On or near Stanway Gardens,E01001352,Ealing 027D,Burglary,
,2011-04,,Metropolitan Police Service,-0.287572,51.509013,On or near Granville Gardens,E01001352,Ealing 027D,Burglary,
,2011-04,,Metropolitan Police Service,-0.283581,51.507867,On or near West Lodge Avenue,E01001354,Ealing 027E,Burglary,
,2011-04,,Metropolitan Police Service,-0.282498,51.508669,On or near Uxbridge Road,E01001354,Ealing 027E,Burglary,
,2011-04,,Metropolitan Police Service,-0.279473,51.507132,On or near Hillcrest Road,E01001354,Ealing 027E,Burglary,
,2011-04,,Metropolitan Police Service,-0.28083,51.50896,On or near Twyford Crescent,E01001354,Ealing 027E,Burglary,
,2011-04,,Metropolitan Police Service,-0.284941,51.508094,On or near Hart Grove,E01001354,Ealing 027E,Burglary,
,2011-04,,Metropolitan Police Service,-0.277724,51.507637,On or near Denehurst Gardens,E01001354,Ealing 027E,Burglary,
,2011-04,,Metropolitan Police Service,-0.323468,51.511007,On or near Green Man Lane,E01001249,Ealing 028A,Burglary,
,2011-04,,Metropolitan Police Service,-0.329817,51.510378,On or near Shirley Gardens,E01001250,Ealing 028B,Burglary,
,2011-04,,Metropolitan Police Service,-0.332403,51.509812,On or near Azalea Close,E01001250,Ealing 028B,Burglary,
