Crime ID,Month,Reported by,Falls within,Longitude,Latitude,Location,LSOA code,LSOA name,Crime type,Last outcome category
,2011-04,,Metropolitan Police Service,0.194301,51.559423,On or near Saunton Road,E01002324,Havering 021E,Burglary,
,2011-04,,Metropolitan Police Service,0.236159,51.563929,On or near Benets Road,E01002255,Havering 022A,Burglary,
,2011-04,,Metropolitan Police Service,0.235077,51.552736,On or near Derby Avenue,E01002292,Havering 022C,Burglary,
,2011-04,,Metropolitan Police Service,0.232926,51.558308,On or near Highfield Crescent,E01002362,Havering 022D,Burglary,
,2011-04,,Metropolitan Police Service,0.246977,51.555953,On or near Gridiron Place,E01002386,Havering 022E,Burglary,
,2011-04,,Metropolitan Police Service,0.219835,51.555238,On or near Station Lane,E01002291,Havering 023B,Burglary,
,2011-04,,Metropolitan Police Service,0.199101,51.550358,On or near The Broadway,E01002365,Havering 023D,Burglary,
,2011-04,,Metropolitan Police Service,0.208605,51.554496,On or near Cedar Road,E01002366,Havering 023E,Burglary,
,2011-04,,Metropolitan Police Service,0.247444,51.534397,On or near Aveley Road,E01002385,Havering 024A,Burglary,
,2011-04,,Metropolitan Police Service,0.252981,51.548994,On or near Coniston Avenue,E01002388,Havering 024C,Burglary,
,2011-04,,Metropolitan Police Service,0.206676,51.543265,On or near Northolt Way,E01002265,Havering 025A,Burglary,
,2011-04,,Metropolitan Police Service,0.212701,51.543772,On or near Bonington Road,E01002288,Havering 025D,Burglary,
,2011-04,,Metropolitan Police Service,0.207605,51.544569,On or near Maybank Avenue,E01002288,Havering 025D,Burglary,
,2011-04,,Metropolitan Police Service,0.214986,51.545689,On or near Edridge Close,E01002288,Havering 025D,Burglary,
,2011-04,,Metropolitan Police Service,0.18978,51.549696,On or near Singleton Close,E01002260,Havering 026A,Burglary,
,2011-04,,Metropolitan Police Service,0.195664,51.551187,On or near Northwood Avenue,E01002261,Havering 026B,Burglary,
,2011-04,,Metropolitan Police Service,0.198084,51.545728,On or near Easedale Drive,E01002262,Havering 026C,Burglary,
,2011-04,,Metropolitan Police Service,0.19562,51.54608,On or near Langdale Gardens,E01002262,Havering 026C,Burglary,
,2011-04,,Metropolitan Police Service,0.199225,51.545167,On or near Silverdale Drive,E01002264,Havering 026E,Burglary,
,2011-04,,Metropolitan Police Service,0.200939,51.542113,On or near Park Lane,E01002264,Havering 026E,Burglary,
,2011-04,,Metropolitan Police Service,0.199128,51.543145,On or near Malan Square,E01002264,Havering 026E,Burglary,
,2011-04,,Metropolitan Police Service,0.201216,51.542477,On or near Astra Close,E01002264,Havering 026E,Burglary,
,2011-04,,Metropolitan Police Service,0.191268,51.541647,On or near Sowrey Avenue,E01002266,Havering 027A,Burglary,
,2011-04,,Metropolitan Police Service,0.192952,51.542784,On or near Stephen Avenue,E01002266,Havering 027A,Burglary,
,2011-04,,Metropolitan Police Service,0.168229,51.527228,On or near South Street,E01002368,Havering 028A,Burglary,
,2011-04,,Metropolitan Police Service,0.167732,51.528595,On or near Lower Mardyke Avenue,E01002368,Havering 028A,Burglary,
,2011-04,,Metropolitan Police Service,0.178607,51.525066,On or near Louise Gardens,E01002369,Havering 028B,Burglary,
,2011-04,,Metropolitan Police Service,0.175865,51.526223,On or near Manser Road,E01002369,Havering 028B,Burglary,
,2011-04,,Metropolitan Police Service,0.185481,51.523508,On or near Evansdale,E01002370,Havering 028C,Burglary,
,2011-04,,Metropolitan Police Service,0.191006,51.524179,On or near Kelburn Way,E01002370,Havering 028C,Burglary,
,2011-04,,Metropolitan Police Service,0.18385,51.529195,On or near Hood Road,E01002371,Havering 028D,Burglary,
,2011-04,,Metropolitan Police Service,0.18388,51.526803,On or near Stanley Road South,E01002371,Havering 028D,Burglary,
,2011-04,,Metropolitan Police Service,0.189224,51.530615,On or near Alexandra Road,E01002371,Havering 028D,Burglary,
,2011-04,,Metropolitan Police Service,0.183691,51.534909,On or near Theydon Gardens,E01002375,Havering 028E,Burglary,
,2011-04,,Metropolitan Police Service,0.18288,51.53362,On or near Courtyard Mews,E01002375,Havering 028E,Burglary,
,2011-04,,Metropolitan Police Service,0.209854,51.526397,On or near Abbots Close,E01002343,Havering 029A,Burglary,
,2011-04,,Metropolitan Police Service,0.208537,51.522411,On or near West View Close,E01002343,Havering 029A,Burglary,
,2011-04,,Metropolitan Police Service,0.188497,51.515457,On or near Lamson Road,E01002344,Havering 029B,Burglary,
,2011-04,,Metropolitan Police Service,0.214173,51.521207,On or near Oreston Road,E01002344,Havering 029B,Burglary,
,2011-04,,Metropolitan Police Service,0.217285,51.525933,On or near Lake Avenue,E01002348,Havering 029C,Burglary,
,2011-04,,Metropolitan Police Service,0.21395,51.524044,On or near King Edward Avenue,E01002349,Havering 029D,Burglary,
,2011-04,,Metropolitan Police Service,0.206391,51.526624,On or near Palmerstone Road,E01002349,Havering 029D,Burglary,
,2011-04,,Metropolitan Police Service,0.213141,51.528466,On or near Berwick Pond Close,E01002349,Havering 029D,Burglary,
,2011-04,,Metropolitan Police Service,0.199073,51.521366,On or near Penny Close,E01002342,Havering 030A,Burglary,
,2011-04,,Metropolitan Police Service,0.196815,51.519978,On or near Glenwood Avenue,E01002345,Havering 030B,Burglary,
,2011-04,,Metropolitan Police Service,0.192059,51.518799,On or near Parkway,E01002345,Havering 030B,Burglary,
,2011-04,,Metropolitan Police Service,0.190283,51.518122,On or near Broadway,E01002345,Havering 030B,Burglary,
,2011-04,,Metropolitan Police Service,0.192637,51.51672,On or near Anglesey Drive,E01002345,Havering 030B,Burglary,
,2011-04,,Metropolitan Police Service,0.195761,51.515753,On or near Ellis Avenue,E01002345,Havering 030B,Burglary,
,2011-04,,Metropolitan Police Service,0.195763,51.514593,On or near Wilfred Avenue,E01002346,Havering 030C,Burglary,
,2011-04,,Metropolitan Police Service,0.206832,51.510698,On or near Wennington Road,E01002347,Havering 030D,Burglary,
,2011-04,,Metropolitan Police Service,-0.445306,51.60721,On or near Hurst Place,E01002473,Hillingdon 001A,Burglary,
,2011-04,,Metropolitan Police Service,-0.440277,51.615749,On or near Tanworth Close,E01002475,Hillingdon 001B,Burglary,
,2011-04,,Metropolitan Police Service,-0.435191,51.614521,On or near Harrison Close,E01002475,Hillingdon 001B,Burglary,
,2011-04,,Metropolitan Police Service,-0.430764,51.6135,On or near Firs Walk,E01002476,Hillingdon 001C,Burglary,
,2011-04,,Metropolitan Police Service,-0.429762,51.614062,On or near Dene Road,E01002476,Hillingdon 001C,Burglary,
,2011-04,,Metropolitan Police Service,-0.425464,51.612206,On or near Oaklands Gate,E01002477,Hillingdon 001D,Burglary,
,2011-04,,Metropolitan Police Service,-0.411589,51.613332,On or near Ravenswood Park,E01002482,Hillingdon 001E,Burglary,
,2011-04,,Metropolitan Police Service,-0.416356,51.607084,On or near High Street,E01002474,Hillingdon 002B,Burglary,
,2011-04,,Metropolitan Police Service,-0.422841,51.610795,On or near Central Way,E01002478,Hillingdon 002C,Burglary,
,2011-04,,Metropolitan Police Service,-0.42163,51.609502,On or near Forge Lane,E01002478,Hillingdon 002C,Burglary,
,2011-04,,Metropolitan Police Service,-0.417981,51.612663,On or near Maycock Grove,E01002478,Hillingdon 002C,Burglary,
,2011-04,,Metropolitan Police Service,-0.407825,51.601186,On or near Briarwood Drive,E01002483,Hillingdon 002D,Burglary,
,2011-04,,Metropolitan Police Service,-0.403502,51.600103,On or near Oakwood Road,E01002483,Hillingdon 002D,Burglary,
,2011-04,,Metropolitan Police Service,-0.401605,51.598224,On or near Woodford Crescent,E01002483,Hillingdon 002D,Burglary,
,2011-04,,Metropolitan Police Service,-0.41317,51.605251,On or near Acre Way,E01002484,Hillingdon 002E,Burglary,
,2011-04,,Metropolitan Police Service,-0.411613,51.60559,On or near Columbus Gardens,E01002484,Hillingdon 002E,Burglary,
,2011-04,,Metropolitan Police Service,-0.409133,51.599703,On or near Ryefield Crescent,E01002485,Hillingdon 002F,Burglary,
,2011-04,,Metropolitan Police Service,-0.410798,51.602899,On or near Pinner Road,E01002485,Hillingdon 002F,Burglary,
,2011-04,,Metropolitan Police Service,-0.482202,51.60379,On or near High Street,E01002439,Hillingdon 003B,Burglary,
,2011-04,,Metropolitan Police Service,-0.478362,51.602473,On or near Burbery Close,E01002441,Hillingdon 003D,Burglary,
,2011-04,,Metropolitan Police Service,-0.483548,51.59763,On or near Church Hill,E01002441,Hillingdon 003D,Burglary,
,2011-04,,Metropolitan Police Service,-0.41059,51.585281,On or near Fore Street,E01002436,Hillingdon 004B,Burglary,
,2011-04,,Metropolitan Police Service,-0.413817,51.592491,On or near Chippenham Close,E01002479,Hillingdon 004C,Burglary,
,2011-04,,Metropolitan Police Service,-0.418866,51.594682,On or near Bramley Close,E01002479,Hillingdon 004C,Burglary,
,2011-04,,Metropolitan Police Service,-0.395991,51.592816,On or near High View,E01002480,Hillingdon 004D,Burglary,
,2011-04,,Metropolitan Police Service,-0.407007,51.591563,On or near Haydon Drive,E01002481,Hillingdon 004E,Burglary,
,2011-04,,Metropolitan Police Service,-0.409764,51.59446,On or near Wyevale Close,E01002481,Hillingdon 004E,Burglary,
,2011-04,,Metropolitan Police Service,-0.40154,51.59308,On or near Wrenwood Way,E01002481,Hillingdon 004E,Burglary,
,2011-04,,Metropolitan Police Service,-0.409391,51.593151,On or near Reid Close,E01002481,Hillingdon 004E,Burglary,
,2011-04,,Metropolitan Police Service,-0.438674,51.577421,On or near Woodville Gardens,E01002533,Hillingdon 005A,Burglary,
,2011-04,,Metropolitan Police Service,-0.445256,51.579936,On or near Glovers Grove,E01002533,Hillingdon 005A,Burglary,
,2011-04,,Metropolitan Police Service,-0.431044,51.575602,On or near Manor Road,E01002534,Hillingdon 005B,Burglary,
,2011-04,,Metropolitan Police Service,-0.439369,51.585775,On or near Brickett Close,E01002538,Hillingdon 005C,Burglary,
,2011-04,,Metropolitan Police Service,-0.435037,51.589188,On or near Dell Farm Road,E01002538,Hillingdon 005C,Burglary,
,2011-04,,Metropolitan Police Service,-0.436672,51.585703,On or near Standale Grove,E01002538,Hillingdon 005C,Burglary,
,2011-04,,Metropolitan Police Service,-0.431817,51.577051,On or near Neats Acre,E01002539,Hillingdon 005D,Burglary,
,2011-04,,Metropolitan Police Service,-0.391263,51.571368,On or near Aragon Drive,E01002418,Hillingdon 006A,Burglary,
,2011-04,,Metropolitan Police Service,-0.397691,51.570331,On or near Pavilion Way,E01002419,Hillingdon 006B,Burglary,
,2011-04,,Metropolitan Police Service,-0.398957,51.574143,On or near Dollis Crescent,E01002419,Hillingdon 006B,Burglary,
,2011-04,,Metropolitan Police Service,-0.400354,51.580799,On or near Field End Road,E01002432,Hillingdon 006D,Burglary,
,2011-04,,Metropolitan Police Service,-0.397297,51.578275,On or near The Close,E01002432,Hillingdon 006D,Burglary,
,2011-04,,Metropolitan Police Service,-0.396169,51.584473,On or near Bridle Road,E01002437,Hillingdon 006E,Burglary,
,2011-04,,Metropolitan Police Service,-0.421419,51.569763,On or near Garden Close,E01002470,Hillingdon 007D,Burglary,
,2011-04,,Metropolitan Police Service,-0.42068,51.569447,On or near Eversley Crescent,E01002470,Hillingdon 007D,Burglary,
,2011-04,,Metropolitan Police Service,-0.428153,51.57408,On or near Monarchs Way,E01002535,Hillingdon 007E,Burglary,
,2011-04,,Metropolitan Police Service,-0.42359,51.57249,On or near Princess Lane,E01002535,Hillingdon 007E,Burglary,
,2011-04,,Metropolitan Police Service,-0.422606,51.574239,On or near South Drive,E01002535,Hillingdon 007E,Burglary,
,2011-04,,Metropolitan Police Service,-0.394943,51.565204,On or near Queens Walk,E01002416,Hillingdon 008A,Burglary,
,2011-04,,Metropolitan Police Service,-0.391215,51.564119,On or near East Mead,E01002416,Hillingdon 008A,Burglary,
,2011-04,,Metropolitan Police Service,-0.401952,51.57476,On or near Oak Grove,E01002417,Hillingdon 008B,Burglary,
,2011-04,,Metropolitan Police Service,-0.400516,51.577438,On or near Morford Way,E01002417,Hillingdon 008B,Burglary,
,2011-04,,Metropolitan Police Service,-0.416774,51.564332,On or near Cherry Close,E01002465,Hillingdon 009A,Burglary,
,2011-04,,Metropolitan Police Service,-0.416438,51.563608,On or near Roundways,E01002465,Hillingdon 009A,Burglary,
,2011-04,,Metropolitan Police Service,-0.422535,51.566712,On or near Crosier Way,E01002467,Hillingdon 009B,Burglary,
,2011-04,,Metropolitan Police Service,-0.416115,51.560465,On or near Bedford Road,E01002494,Hillingdon 009C,Burglary,
,2011-04,,Metropolitan Police Service,-0.419631,51.561817,On or near Stafford Road,E01002494,Hillingdon 009C,Burglary,
,2011-04,,Metropolitan Police Service,-0.418405,51.561387,On or near Bromley Crescent,E01002494,Hillingdon 009C,Burglary,
,2011-04,,Metropolitan Police Service,-0.4366,51.567214,On or near Aylsham Drive,E01002537,Hillingdon 009E,Burglary,
,2011-04,,Metropolitan Police Service,-0.406139,51.563541,On or near Flamborough Road,E01002466,Hillingdon 010B,Burglary,
,2011-04,,Metropolitan Police Service,-0.406526,51.568168,On or near Filey Waye,E01002468,Hillingdon 010C,Burglary,
,2011-04,,Metropolitan Police Service,-0.409316,51.566362,On or near Tiverton Road,E01002468,Hillingdon 010C,Burglary,
,2011-04,,Metropolitan Police Service,-0.41286,51.571068,On or near Sunnydene Avenue,E01002469,Hillingdon 010D,Burglary,
,2011-04,,Metropolitan Police Service,-0.399527,51.560393,On or near West Mead,E01002495,Hillingdon 010E,Burglary,
,2011-04,,Metropolitan Police Service,-0.453057,51.56567,On or near Irwin Close,E01002458,Hillingdon 011A,Burglary,
,2011-04,,Metropolitan Police Service,-0.444494,51.560395,On or near Edinburgh Close,E01002460,Hillingdon 011C,Burglary,
,2011-04,,Metropolitan Police Service,-0.443727,51.56088,On or near Edinburgh Drive,E01002460,Hillingdon 011C,Burglary,
,2011-04,,Metropolitan Police Service,-0.443296,51.563797,On or near Community Close,E01002460,Hillingdon 011C,Burglary,
,2011-04,,Metropolitan Police Service,-0.446985,51.561382,On or near Neela Close,E01002460,Hillingdon 011C,Burglary,
,2011-04,,Metropolitan Police Service,-0.434377,51.560522,On or near Austins Lane,E01002464,Hillingdon 011E,Burglary,
,2011-04,,Metropolitan Police Service,-0.438627,51.558573,On or near Milverton Drive,E01002464,Hillingdon 011E,Burglary,
,2011-04,,Metropolitan Police Service,-0.436809,51.557326,On or near Sussex Road,E01002464,Hillingdon 011E,Burglary,
,2011-04,,Metropolitan Police Service,-0.438211,51.559763,On or near Glebe Close,E01002464,Hillingdon 011E,Burglary,
,2011-04,,Metropolitan Police Service,-0.439343,51.561676,On or near Kempton Close,E01002464,Hillingdon 011E,Burglary,
,2011-04,,Metropolitan Police Service,-0.469338,51.563779,On or near The Drive,E01002461,Hillingdon 013A,Burglary,
,2011-04,,Metropolitan Police Service,-0.465123,51.562133,On or near Roker Park Avenue,E01002461,Hillingdon 013A,Burglary,
,2011-04,,Metropolitan Police Service,-0.448533,51.558695,On or near Court Road,E01002463,Hillingdon 013B,Burglary,
,2011-04,,Metropolitan Police Service,-0.445965,51.546441,On or near Regent Avenue,E01002451,Hillingdon 014B,Burglary,
,2011-04,,Metropolitan Police Service,-0.44758,51.546867,On or near Brighton Close,E01002451,Hillingdon 014B,Burglary,
,2011-04,,Metropolitan Police Service,-0.44432,51.543929,On or near Grosvenor Crescent,E01002453,Hillingdon 014D,Burglary,
,2011-04,,Metropolitan Police Service,-0.438145,51.541473,On or near Cowdray Road,E01002454,Hillingdon 014E,Burglary,
,2011-04,,Metropolitan Police Service,-0.441606,51.542742,On or near Leybourne Road,E01002454,Hillingdon 014E,Burglary,
,2011-04,,Metropolitan Police Service,-0.470248,51.534945,On or near Ivy Bridge Close,E01002414,Hillingdon 015A,Burglary,
,2011-04,,Metropolitan Police Service,-0.474583,51.537663,On or near Cornfield Close,E01002414,Hillingdon 015A,Burglary,
,2011-04,,Metropolitan Police Service,-0.479394,51.548201,On or near Redford Way,E01002514,Hillingdon 015C,Burglary,
,2011-04,,Metropolitan Police Service,-0.474219,51.545112,On or near Cumbrian Way,E01002515,Hillingdon 015D,Burglary,
,2011-04,,Metropolitan Police Service,-0.476344,51.546264,On or near George Street,E01002515,Hillingdon 015D,Burglary,
,2011-04,,Metropolitan Police Service,-0.463913,51.546228,On or near Keith Park Road,E01002515,Hillingdon 015D,Burglary,
,2011-04,,Metropolitan Police Service,-0.469047,51.536772,On or near Amberley Way,E01033725,Hillingdon 015F,Burglary,
,2011-04,,Metropolitan Police Service,-0.477936,51.53874,On or near Burness Close,E01033725,Hillingdon 015F,Burglary,
,2011-04,,Metropolitan Police Service,-0.475489,51.54164,On or near Manor Waye,E01033725,Hillingdon 015F,Burglary,
,2011-04,,Metropolitan Police Service,-0.488845,51.541993,On or near St John'S Road,E01002520,Hillingdon 016B,Burglary,
,2011-04,,Metropolitan Police Service,-0.491073,51.539153,On or near Hilton Close,E01002520,Hillingdon 016B,Burglary,
,2011-04,,Metropolitan Police Service,-0.493621,51.537963,On or near Eskdale Road,E01002520,Hillingdon 016B,Burglary,
,2011-04,,Metropolitan Police Service,-0.48732,51.540579,On or near Dukes Way,E01002520,Hillingdon 016B,Burglary,
,2011-04,,Metropolitan Police Service,-0.478953,51.544562,On or near Vine Street,E01002521,Hillingdon 016C,Burglary,
,2011-04,,Metropolitan Police Service,-0.484919,51.545548,On or near Rockingham Parade,E01002521,Hillingdon 016C,Burglary,
,2011-04,,Metropolitan Police Service,-0.485755,51.538635,On or near Mill Avenue,E01002523,Hillingdon 016D,Burglary,
,2011-04,,Metropolitan Police Service,-0.48548,51.541688,On or near Fray'S Waye,E01002523,Hillingdon 016D,Burglary,
,2011-04,,Metropolitan Police Service,-0.483031,51.539454,On or near Bridge Road,E01002523,Hillingdon 016D,Burglary,
,2011-04,,Metropolitan Police Service,-0.482998,51.531351,On or near Barchester Close,E01033724,Hillingdon 016F,Burglary,
,2011-04,,Metropolitan Police Service,-0.483244,51.535662,On or near Hogarth Close,E01033724,Hillingdon 016F,Burglary,
,2011-04,,Metropolitan Police Service,-0.482929,51.530388,On or near Heritage Close,E01033724,Hillingdon 016F,Burglary,
,2011-04,,Metropolitan Police Service,-0.477825,51.535133,On or near Norton Road,E01033724,Hillingdon 016F,Burglary,
,2011-04,,Metropolitan Police Service,-0.481457,51.531736,On or near Buchan Close,E01033724,Hillingdon 016F,Burglary,
,2011-04,,Metropolitan Police Service,-0.455359,51.533068,On or near Hilliers Avenue,E01002410,Hillingdon 017A,Burglary,
,2011-04,,Metropolitan Police Service,-0.449277,51.530884,On or near Uxbridge Road,E01002410,Hillingdon 017A,Burglary,
,2011-04,,Metropolitan Police Service,-0.458167,51.52592,On or near Copperfield Avenue,E01002412,Hillingdon 017B,Burglary,
,2011-04,,Metropolitan Police Service,-0.465997,51.526715,On or near Normans Close,E01002412,Hillingdon 017B,Burglary,
,2011-04,,Metropolitan Police Service,-0.457334,51.52412,On or near Colham Green Road,E01002412,Hillingdon 017B,Burglary,
,2011-04,,Metropolitan Police Service,-0.464776,51.526582,On or near Newcroft Close,E01002412,Hillingdon 017B,Burglary,
,2011-04,,Metropolitan Police Service,-0.452157,51.538214,On or near Long Lane,E01002456,Hillingdon 017C,Burglary,
,2011-04,,Metropolitan Police Service,-0.450147,51.537972,On or near Clifton Gardens,E01002456,Hillingdon 017C,Burglary,
,2011-04,,Metropolitan Police Service,-0.44791,51.5393,On or near Oakdene Road,E01002456,Hillingdon 017C,Burglary,
,2011-04,,Metropolitan Police Service,-0.462156,51.535882,On or near The Crossway,E01002509,Hillingdon 017D,Burglary,
,2011-04,,Metropolitan Police Service,-0.464891,51.536026,On or near The Fairway,E01002509,Hillingdon 017D,Burglary,
,2011-04,,Metropolitan Police Service,-0.457797,51.538163,On or near Mills Close,E01002509,Hillingdon 017D,Burglary,
,2011-04,,Metropolitan Police Service,-0.422161,51.532078,On or near Adelphi Way,E01002422,Hillingdon 018A,Burglary,
,2011-04,,Metropolitan Police Service,-0.422292,51.530776,On or near Byron Way,E01002422,Hillingdon 018A,Burglary,
,2011-04,,Metropolitan Police Service,-0.43466,51.526211,On or near Hayes End Close,E01002423,Hillingdon 018B,Burglary,
,2011-04,,Metropolitan Police Service,-0.433309,51.525672,On or near Newport Road,E01002423,Hillingdon 018B,Burglary,
,2011-04,,Metropolitan Police Service,-0.440754,51.52926,On or near Hewens Road,E01002423,Hillingdon 018B,Burglary,
,2011-04,,Metropolitan Police Service,-0.416604,51.527669,On or near Pine Place,E01002424,Hillingdon 018C,Burglary,
,2011-04,,Metropolitan Police Service,-0.425918,51.526373,On or near Haven Close,E01002427,Hillingdon 018E,Burglary,
,2011-04,,Metropolitan Police Service,-0.425085,51.537566,On or near Ullswater Close,E01002428,Hillingdon 018F,Burglary,
,2011-04,,Metropolitan Police Service,-0.444589,51.527998,On or near Nellgrove Road,E01002408,Hillingdon 019A,Burglary,
,2011-04,,Metropolitan Police Service,-0.450166,51.526363,On or near Hindhead Close,E01002408,Hillingdon 019A,Burglary,
,2011-04,,Metropolitan Police Service,-0.445398,51.525833,On or near Haig Road,E01002409,Hillingdon 019B,Burglary,
,2011-04,,Metropolitan Police Service,-0.445362,51.524348,On or near Morello Avenue,E01002409,Hillingdon 019B,Burglary,
,2011-04,,Metropolitan Police Service,-0.444533,51.523708,On or near Cherry Grove,E01002409,Hillingdon 019B,Burglary,
,2011-04,,Metropolitan Police Service,-0.441847,51.524706,On or near Green Lane,E01002409,Hillingdon 019B,Burglary,
,2011-04,,Metropolitan Police Service,-0.438753,51.536778,On or near Gainsborough Road,E01002429,Hillingdon 019C,Burglary,
,2011-04,,Metropolitan Police Service,-0.435321,51.537209,On or near Romney Road,E01002429,Hillingdon 019C,Burglary,
,2011-04,,Metropolitan Police Service,-0.437736,51.53573,On or near The Oaks,E01002429,Hillingdon 019C,Burglary,
,2011-04,,Metropolitan Police Service,-0.441741,51.534992,On or near Charville Lane,E01002455,Hillingdon 019D,Burglary,
,2011-04,,Metropolitan Police Service,-0.442663,51.529519,On or near Heath Road,E01002455,Hillingdon 019D,Burglary,
,2011-04,,Metropolitan Police Service,-0.447029,51.535089,On or near The Dingle,E01002457,Hillingdon 019E,Burglary,
,2011-04,,Metropolitan Police Service,-0.405465,51.532904,On or near Attlee Close,E01002392,Hillingdon 020A,Burglary,
,2011-04,,Metropolitan Police Service,-0.3984,51.532097,On or near Bryant Road,E01002393,Hillingdon 020B,Burglary,
,2011-04,,Metropolitan Police Service,-0.388724,51.527658,On or near Repens Way,E01002540,Hillingdon 020C,Burglary,
,2011-04,,Metropolitan Police Service,-0.392394,51.529461,On or near Hobart Lane,E01002540,Hillingdon 020C,Burglary,
,2011-04,,Metropolitan Police Service,-0.39861,51.528575,On or near Yeading Lane,E01002542,Hillingdon 020D,Burglary,
,2011-04,,Metropolitan Police Service,-0.396313,51.529128,On or near Dunedin Way,E01002542,Hillingdon 020D,Burglary,
,2011-04,,Metropolitan Police Service,-0.396298,51.527501,On or near Norcott Close,E01002542,Hillingdon 020D,Burglary,
,2011-04,,Metropolitan Police Service,-0.394735,51.526859,On or near Willow Tree Lane,E01002543,Hillingdon 020E,Burglary,
,2011-04,,Metropolitan Police Service,-0.404024,51.523802,On or near Findhorn Avenue,E01002395,Hillingdon 021B,Burglary,
,2011-04,,Metropolitan Police Service,-0.419166,51.52363,On or near Kenilworth Gardens,E01002397,Hillingdon 021C,Burglary,
,2011-04,,Metropolitan Police Service,-0.417894,51.524548,On or near Tithe Close,E01002397,Hillingdon 021C,Burglary,
,2011-04,,Metropolitan Police Service,-0.413719,51.524419,On or near Balmoral Drive,E01002398,Hillingdon 021D,Burglary,
,2011-04,,Metropolitan Police Service,-0.402889,51.521224,On or near Yeading Lane,E01002399,Hillingdon 021E,Burglary,
,2011-04,,Metropolitan Police Service,-0.424439,51.525391,On or near Westacott,E01002426,Hillingdon 021F,Burglary,
,2011-04,,Metropolitan Police Service,-0.474949,51.526274,On or near Abbott'S Close,E01002411,Hillingdon 022A,Burglary,
,2011-04,,Metropolitan Police Service,-0.476437,51.523164,On or near St Helen Close,E01002411,Hillingdon 022A,Burglary,
,2011-04,,Metropolitan Police Service,-0.475354,51.528833,On or near Huxley Close,E01002411,Hillingdon 022A,Burglary,
,2011-04,,Metropolitan Police Service,-0.477977,51.525837,On or near Maygoods Green,E01002411,Hillingdon 022A,Burglary,
,2011-04,,Metropolitan Police Service,-0.477967,51.525253,On or near Maygoods Lane,E01002411,Hillingdon 022A,Burglary,
,2011-04,,Metropolitan Police Service,-0.478219,51.531559,On or near The Avenue,E01002518,Hillingdon 022C,Burglary,
,2011-04,,Metropolitan Police Service,-0.480138,51.528914,On or near Belgrave Mews,E01002518,Hillingdon 022C,Burglary,
,2011-04,,Metropolitan Police Service,-0.478016,51.527681,On or near Clayton Way,E01002518,Hillingdon 022C,Burglary,
,2011-04,,Metropolitan Police Service,-0.477925,51.529119,On or near Orchard Drive,E01002518,Hillingdon 022C,Burglary,
,2011-04,,Metropolitan Police Service,-0.482436,51.524816,On or near High Road,E01002519,Hillingdon 022D,Burglary,
,2011-04,,Metropolitan Police Service,-0.482402,51.52281,On or near Verona Close,E01002519,Hillingdon 022D,Burglary,
,2011-04,,Metropolitan Police Service,-0.480949,51.524464,On or near Cowley Crescent,E01002519,Hillingdon 022D,Burglary,
,2011-04,,Metropolitan Police Service,-0.471008,51.518715,On or near Coltsfoot Drive,E01002550,Hillingdon 022E,Burglary,
,2011-04,,Metropolitan Police Service,-0.477346,51.511046,On or near Tavistock Road,E01002554,Hillingdon 022F,Burglary,
,2011-04,,Metropolitan Police Service,-0.474198,51.509944,On or near Station Road,E01002554,Hillingdon 022F,Burglary,
,2011-04,,Metropolitan Police Service,-0.475563,51.515249,On or near Gurnard Close,E01002554,Hillingdon 022F,Burglary,
,2011-04,,Metropolitan Police Service,-0.476629,51.511783,On or near Wimpole Road,E01002554,Hillingdon 022F,Burglary,
,2011-04,,Metropolitan Police Service,-0.47109,51.512394,On or near Albert Road,E01002554,Hillingdon 022F,Burglary,
